ncaa_id,game_id,date,home,home_fouls,home_technicals,visitor,visitor_fouls,visitor_technicals,officials
30124,8153,11/12/2022,Cedarville,21,0,Ferris State,14,0,"Todd Moistner,  Chad Beck,  David Griffith"
30126,8196,11/12/2022,Gannon,16,0,Notre Dame (OH),19,0,"Narissa Williams,  Kristen Csontos,  Scott Dutterer"
30127,4216,11/11/2022,Chaminade,13,1,Simon Fraser,19,0,"Starr Rivera,  Steve Piery,  Pete Arceo"
30127,4217,11/12/2022,Hawaii Pacific,28,0,Simon Fraser,25,1,"Tiki Kahoano,  William  Diaz-Wilson,  Clayton Tang"
30128,4949,11/12/2022,Sioux Falls,11,0,Fort Hays St.,15,0,"Jeremy Zacher,  Chad DeJong,  MJ Wagenson"
30128,4948,11/11/2022,Sioux Falls,18,0,Missouri Western,17,0,"Jordan Voss,  Terry Reynolds,  Marlin Schoonhoven"
30134,5901,11/12/2022,Black Hills St.,21,0,Tex. A&M-Kingsville,19,0,"Ike Jessee,  Hayden  Peters,  Craig Thompson"
30134,5900,11/11/2022,Black Hills St.,19,0,Tex. A&M Int'l,12,0,"Domico  Rodriguez,  Rory Robinson,  Jacob Finn"
30136,25066,11/7/2022,Eastern Mich.,17,1,Lindenwood,11,0,"Kristen Morris,  Crathman Stephens,  Nathan  Baker"
30138,15533,11/12/2022,McKendree,16,0,Purdue Northwest,17,0,"KELVIN LITTLE,  REYES RAMIREZ,  BOB OWENS"
30138,15532,11/11/2022,Tiffin,21,0,McKendree,15,0,John Doe
30139,8602,11/12/2022,South Dakota Mines,21,0,West Tex. A&M,20,2,"Genevieve Osborn,  Beau Garcia,  Tim Devlin"
30139,8601,11/11/2022,South Dakota Mines,25,0,Tex. Permian Basin,22,0,"Katelynn Hall,  Karli Jelden,  Dillon Fuller"
30140,3853,11/13/2022,Truman St.,14,0,Ursuline,15,0,"Pat  Campbell,  Stacey Thomas,  Jeff Klaus"
30140,3852,11/12/2022,Quincy,22,0,Ursuline,21,0,"Charles Morrison,  Nicole Fisher,  Amanda Chapman"
30147,7725,11/11/2022,Chico St.,21,0,Fresno Pacific,16,0,"Morgan Fradley,  Eduardo Cuan,  Darlenn Hargrove"
30147,7726,11/12/2022,Fresno Pacific,18,0,Sonoma St.,19,0,"Morgan  Fradley,  James Yee,  Lajwan Robinson"
30149,13904,11/11/2022,Cal St. San B'dino,20,0,Point Loma,18,0,"Marissa Cannon,  Enrique Arroyo,  Joshua Batin"
30149,13905,11/12/2022,Point Loma,11,0,Cal Poly Pomona,18,0,"April Harding,  Jared Snyder,  Adam Candee"
30151,5460,11/12/2022,Shorter,18,1,Lynn,10,0,"Dominique Dawson,  Anddie Perlum,  Michael Prociuk"
30152,5599,11/6/2022,Southern Nazarene,20,0,Fort Hays St.,16,0,"Jared Wilson,  Leah Lanie,  Ty Bills"
30152,5598,11/5/2022,Neb.-Kearney,12,0,Southern Nazarene,18,0,"Jeremy McHugh,  Allyn Richardson,  Michelle Kramer"
30160,5159,11/8/2022,SUNY Delhi,18,0,Houghton,13,0,"Marty McGraw,  Michael Velardi,  Randy Mudge"
30160,5160,11/12/2022,SUNY Canton,21,0,Houghton University,24,0,"Tom Chichester,  George Dyer,  Andy Guay"
30165,8669,11/12/2022,SUNY Canton,21,0,Houghton University,24,0,"Tom Chichester,  George Dyer,  Andy Guay"
30165,8668,11/11/2022,SUNY Canton,11,0,Wells College,7,0,"Jim Myers,  Yale Wall,  Michael Roberts"
30165,8667,11/8/2022,SUNY Canton,15,0,Paul Smith's College,5,0,"Stephen Ansari,  Jim Myers,  Chaz Loomis"
30171,2252,11/11/2022,Berea,20,0,Pfeiffer University,26,0,"Shereka Brown,  Michael Morris,  Joseph Crider"
30171,2253,11/12/2022,Methodist University,19,0,Berea,15,0,"Tori Durrett,  John McMillin,  Elizabeth Kennedy"
30174,6792,11/11/2022,Daemen,16,0,Pace,16,0,"Reginald Houston,  Mike LaCroix,  Greg Bischoping"
30174,6793,11/12/2022,Daemen,25,0,Felician,19,0,"Christopher Helinski,  Katie Hannon,  Ron Cooper"
30175,4178,11/12/2022,Cal St. Monterey Bay,19,0,Holy Names,29,1,"Jay Ferrick,  Sarah Barr,  Dominique Hunter"
30175,4179,11/11/2022,San Fran. St.,18,0,Holy Names,14,1,"Julia Allende,  Chris Hirano,  Kathleen Cassidy"
30177,11096,11/11/2022,Lubbock Christian,13,0,Colo. Christian,22,0,"Alika Arisumi,  Travis Clark,  Randall Arbuckle"
30177,11097,11/12/2022,Lubbock Christian,16,1,CSU Pueblo,23,1,"Kelsey Curry,  Corey Malone,  Michael Nkollo"
30177,11094,11/5/2022,Mo. Southern St.,20,0,Lubbock Christian,14,0,"Drew Roberts, Leah Lanie, Ty Bills"
30177,11095,11/6/2022,Lubbock Christian,23,0,Missouri Western,26,0,"Jeremy McHugh,  Allyn Richardson,  Michelle Kramer"
30180,6372,11/12/2022,Northern St.,18,0,Rogers St.,24,0,"Eric Ringeisen,  Spencer Halvorson,  Jim Erzar"
30180,6371,11/11/2022,MSU Moorhead,12,0,Rogers St.,16,0,"Nic Thompson,  Josh Junker,  LeAnn Hall"
30181,6535,11/13/2022,UVA Wise,11,0,Flagler,15,0,"Kim Crabtree,  Tony Sherrill and Jerry Lawson."
30181,6536,11/12/2022,UVA Wise,19,0,Clayton St.,24,0,"Ryan Freeman,  Beau Carr,  Jimmie Mills"
30190,3299,11/8/2022,Penn College,13,0,Elmira,13,0,", , "
30199,10888,11/11/2022,Cui,17,0,Cal State LA,19,0,"April Harding,  Brenda Castillo,  Alicia  Iwakiri"
30202,10443,11/12/2022,Washburn,12,0,Okla. Baptist,16,0,"Payton Everett,  Jason  Lafaciano,  Rodney Palen"
30202,10442,11/11/2022,Pittsburg St.,16,0,Okla. Baptist,13,0,"Jocelyn Price,  Todd  Dahlof,  Larry Hare"
30209,7814,11/12/2022,Westminster (UT),17,0,Ark.-Fort Smith,16,0,"Kayla Barker,  Dan Hooten,  Jessica Omer"
30209,7812,11/7/2022,Idaho St.,13,0,Westminster (UT),17,0,"Nicholas Mitch,  Teresa Olsen,  Rick Thorne"
30209,7813,11/11/2022,Westminster (UT),11,0,Ark.-Fort Smith,21,0,"Jessica Omer,  Rick Thorne,  Steph Stassen"
30219,2082,11/8/2022,Curry,23,0,Dean,21,0,"Michael Walsh,  Paul Maiella,  Heaather Durbrow"
30220,16821,11/11/2022,Biola,13,0,Cal St. Dom. Hills,17,0,"B. Bong,  B. Okamoto,  B. Self"
30220,16822,11/12/2022,Biola,20,0,Cal State LA,15,0,"Ben Leech,  Jeff Benson,  Marissa Cannon"
30221,69967,11/11/2022,Maryville (MO),12,0,Davenport,25,0,"Chad Ozee,  Erica Smith,  Dominic Blesener"
30221,69968,11/12/2022,Mo.-St. Louis,20,1,Davenport,12,0,"Rachel Lenz, Kenny Williams, Colin Thiele"
30222,5919,11/12/2022,McKendree,16,0,Purdue Northwest,17,0,"KELVIN LITTLE,  REYES RAMIREZ,  BOB OWENS"
307,7779,11/11/2022,Indiana (PA),13,0,Davis & Elkins,25,0,"Charlene Lybbert,  Christopher Boyer,  Michael Ognosky"
309,11948,11/11/2022,UIndy,20,0,Malone,24,0,"Kyente Bryson,  Phillip Crawford,  Kayla Maxey"
313,18386,11/11/2022,Montclair St.,14,0,Ithaca,16,0,"Morgan  Taylor,  David Claudio,  Tracey Stamper"
314,3184,11/12/2022,Colorado,22,0,Jackson St.,11,0,"Sean Martin,  Anita  Ortega,  Michol Murray"
314,3183,11/9/2022,North Carolina,19,0,Jackson St.,21,0,"Courtney Robinson,  Ashley Gloss,  Timothy Bryant"
315,6791,11/7/2022,Jacksonville St.,18,0,Shorter,19,0,"Natalie Lehmann,  Kesha Tardy,  Leslie Claybrook"
315,6792,11/13/2022,Georgia,14,0,Jacksonville St.,19,0,"Travis Jones,  Gina Cross,  Denise Brooks"
317,18960,11/13/2022,James Madison,20,0,Queens (NC),19,0,"Chastity Taylor,  Kara Hunter,  Timothy Greene"
317,19040,11/9/2022,Millersville,18,0,James Madison,21,0,"David Troyan,  Chrisopher Boyer,  Bridget Borelli"
317,18959,11/7/2022,James Madison,10,0,Maine,17,0,"Charles Watson,  Ray Bullock Jr.,  Cara Seggie"
320,11215,11/11/2022,John Carroll,16,0,Allegheny,25,0,"Pat Campbell,  Tory Capasso,  Kristen Csontos"
321,10875,11/12/2022,John Jay,24,0,Rutgers-Camden,27,0,"Sharvez Brown,  Candice Lindsay,  Jospeh Dooley"
321,10874,11/9/2022,John Jay,16,0,Farmingdale St.,17,0,"Daniel Stefankiewicz,  Brittany Meyer,  Brian Callahan"
322,16769,11/8/2022,Johns Hopkins,17,0,York (PA),11,0,"Kevin Brooks,  Tammy Holman,  Paulette Franklin "
322,16771,11/12/2022,Texas-Dallas,14,0,Johns Hopkins,17,0,"Paul Cone Jr.,  Brandon Long,  Robert McDow"
322,16770,11/11/2022,Messiah,11,0,Johns Hopkins,16,0,"Keith Batson,  Paul Cone Jr.,  Robert McDow"
330,12295,11/12/2022,Southern Maine,12,0,Keene State,11,0,"Nicholas Murray,  Justin Underwood,  Jonathan McLaughlin"
330,12294,11/8/2022,Westfield State,13,0,Keene State,17,0,"Kathy Allen,  Kevin Lecuyer,  Randy Namin"
335,6394,11/12/2022,Capital,19,0,Kenyon,16,0,"Bob Balak,  Thurmann Leggs,  Dave Gross"
335,6393,11/8/2022,Kenyon,16,0,Defiance,14,0,"Noah Williams,  Silas Bowers,  Lori Francescon"
336,9101,11/8/2022,King's (PA),17,0,Gwynedd Mercy,18,0,"David Gnall,  Melinda Moore,  Jarra Dennis"
336,9103,11/12/2022,King's (PA),21,0,Susquehanna,20,0,"Kevin Paul,  Duane Gordon,  Aaron Rush"
336,9102,11/10/2022,Penn State Schuylkill,19,0,Kings College,22,0,", , "
337,4702,11/11/2022,Blackburn,16,0,Knox,12,0,"Gabe Jones,  Lucas Smith,  Bill Wood"
339,13024,11/12/2022,Fayetteville St.,19,0,Kutztown,12,0,"Sharon  Haddock,  Jeffrey Erisman,  Joseph Emerson"
339,12990,11/11/2022,Kutztown,15,0,Bowie St.,12,0,"Camille Johnson,  Courtney Cozart,  Jarra Dennis"
348,4247,11/11/2022,St. Norbert College,18,0,Lawrence Univ.,25,0,"Ron Quirk,  Julie Phillips,  Krystal Ellis"
348,4246,11/8/2022,Rockford,23,0,Lawrence,14,0,"Daniel  West,  Matthew Vanevenhoven,  Paul Novak"
348,4248,11/12/2022,Lawrence Univ.,12,0,UW-La Crosse,23,0,"Jason Wolfe,  Matt Vanevenhoven,  Dan West"
35,6987,11/11/2022,Wayne St. (MI),17,0,Ashland,25,0,"Jason Wildey,  Stacey Thomas,  Sarah Burgess"
366,11713,11/7/2022,Louisiana Tech,22,0,Central Baptist,22,1,"Nina Norman,  Matt Krenek,  Jaclyn Watson"
366,11714,11/10/2022,Louisiana Tech,14,0,Arkansas St.,14,0,"Travis Jones,  Sarah Fleming,  Chaney Muench"
366,11715,11/13/2022,Ulm,18,0,Louisiana Tech,12,1,"John Fletcher,  Britton Sherry,  D'Lynn Schertz"
370,14797,11/7/2022,Washington St.,14,0,Lmu (Ca),20,0,"Esther Hsu,  Corey Long,  Lisa Jones"
370,14798,11/11/2022,Lmu (Ca),18,0,Cal St. San Marcos,20,0,"Jen Zylstra,  Kelly Broomsfield,  Kimberly Hobbs"
372,4744,11/12/2022,Carleton,18,0,Luther,14,0,"Lacy Masden,  Chris Katke,  Teron Buford"
373,16006,11/13/2022,Lycoming,20,1,Penn St. Harrisburg,23,0,"Reza Pourrabi,  Christian Cintron,  David Troyan"
373,16005,11/12/2022,Elizabethtown,16,0,Lycoming,20,0,"Amanda Feldman,  Shelbey Lorenzetty,  Carolyn Allen"
376,9290,11/11/2022,Chapman,15,0,Macalester,11,0,"Alissa Camanero,  April Harding,  Jerome Winston"
384,12314,11/12/2022,D'Youville,15,1,Mansfield,23,1,"Rick Gudowski,  Jeff Irwin,  David Toole"
385,8291,11/8/2022,Marietta,13,0,Wash. & Jeff.,18,0,"Alex Gebers,  Chris Derico,  Jason Wilkinson"
395,5913,11/12/2022,Maryville (MO),23,0,Grand Valley St.,20,0,"Sean Carver,  Reba McBurrows,  Shane Bennett"
395,5912,11/11/2022,Maryville (MO),12,0,Davenport,25,0,"Chad Ozee,  Erica Smith,  Dominic Blesener"
398,9715,11/12/2022,Emmanuel (MA),29,0,Mit,20,0,"Jacinda Lambert,  Matt Coute,  John Williams"
408,12813,11/12/2022,West Liberty,25,0,Mercyhurst,35,0,"Brittany  Harris,  Dash McNeal,  Eric Pethtel"
41,11513,11/12/2022,Augustana (SD),15,0,Missouri Western,21,0,"Ashley Diesting,  Kevin Schultz,  Jim Harding"
41,11512,11/11/2022,Augustana (SD),12,0,Fort Hays St.,11,0,"Justin Kaus,  Kelly Ternes,  Tony Schrepfer"
411,10343,11/12/2022,Rochester (NY),9,0,Messiah,16,0,"Brock Matlock,  Ron Macomber Jr.,  Victor Torregiano"
411,10342,11/11/2022,Messiah,11,0,Johns Hopkins,16,0,"Keith Batson,  Paul Cone Jr.,  Robert McDow"
413,8160,11/12/2022,MSU Denver,21,0,Texas Woman's,18,0,"Shanese Gose,  Genesis Perrymond,  Andy Heo"
413,8159,11/11/2022,Angelo St.,23,0,MSU Denver,25,0,"Michaela Fox,  Jeff Gotto,  Denise Lopez"
42,11125,11/8/2022,Aurora,20,0,Elmhurst,21,0,"Jamila Wilson,  Shante Glenn,  Cria Haro"
420,12457,11/12/2022,Middlebury,21,0,Mt. St. Mary (NY),20,0,"Kyle Wiscott,  Ceferino Torres,  Matthew LeBlanc"
422,3072,11/13/2022,Miles,17,2,Savannah St.,14,1,"Neonta Williams,  Courtney Walker,  Stanley Wormley"
422,3071,11/11/2022,Miles,13,1,Oakwood,17,0,"A. Carr,  A. Gilmore,  T. Williams"
423,8784,11/12/2022,Millersville,14,0,Shaw,19,0,"Timothy Lavelle,  Joseph Bleacher,  Tony Blaisure"
427,9140,11/5/2022,Missouri Western,17,0,Minn. Duluth,14,0,"Jared Wilson,  Chris Cooper,  Nick Marshall"
427,9141,11/6/2022,Minn. Duluth,12,0,Mo. Southern St.,19,0,"Kalee Davidson,  Jake Coody,  Zac Brost"
429,11606,11/11/2022,LeMoyne-Owen,20,0,Mississippi Col.,6,0,"Adam Welch,  Brian Kilgore,  Anthony George"
429,11607,11/12/2022,Mississippi Col.,18,0,Tuskegee,15,1,"Meghan Dawnes,  Manin Bruce,  Tim Cooper"
432,4705,11/9/2022,Mississippi St.,12,0,Mississippi Val.,17,0,"Saif Esho,  Talisa Green,  Maj Forsberg"
432,5221,11/11/2022,Lsu,14,0,Mississippi Val.,20,0,"Deanna Jackson,  Christopher Saucedo,  Timothy Greene"
435,15271,11/11/2022,Wis.-Parkside,15,0,Missouri S&T,20,0,"Austin Edge,  Todd Hoke,  Jodi Duffe"
435,15272,11/12/2022,Missouri S&T,19,0,Walsh,13,0,"Kevin St.John,  Matt Andrews,  Steve Matuszewski"
436,4306,11/11/2022,Mo.-St. Louis,16,0,Grand Valley St.,8,0,"Reba McBurrows, Keith Kee, Jason Schmitz"
436,4307,11/12/2022,Mo.-St. Louis,20,1,Davenport,12,0,"Rachel Lenz, Kenny Williams, Colin Thiele"
438,9103,11/8/2022,Greenville,24,0,Monmouth (IL),20,0,"William Wood,  Sean Carver,  Kalee Davidson"
44,9364,11/12/2022,Averett,19,0,Mid-Atlantic Christian,22,0,", , "
44,9363,11/11/2022,Averett,19,0,Carolina University,19,0,", , "
44,9362,11/8/2022,Chris. Newport,21,0,Averett,20,0,"DJ Chapman,  Byron Purnell,  Melquan Williams-Morris"
446,5870,11/7/2022,Morgan State,13,0,Shepherd,20,0,"Darrell Mitchell,  Latifa Boyce,  Cliff Jones"
446,5871,11/10/2022,Morgan State,18,0,Loyola Maryland,16,0,"Edward Matthew,  Paulette Franklin,  Christian Cintron"
453,4768,11/12/2022,Hartwick,15,0,Muhlenberg,17,0,"David  Dence, Gregory Teeter, Charles Rydzak"
460,9567,11/7/2022,Uncw,19,0,Lenoir-Rhyne,12,0,"Brianna Robinson,  Wesley Carter,  Michael Johnson"
460,9568,11/13/2022,East Carolina,20,0,Uncw,19,0,"Deanna Jackson,  Timothy Bryant,  Bryan Burnette"
461,8211,11/12/2022,Swatwbb,25,0,Nazareth,15,0,"Michael Latino,  Tarif Jackson  ,  Mickeni Caldwell"
461,8210,11/11/2022,Vassar College,22,0,Nazareth,15,0,"Mickeni Caldwell,  Ronnie Stephenson,  Michael Kaczor"
462,7209,11/12/2022,Neb. Wesleyan,26,0,Grinnell,16,0,Tyler Eason
465,15439,11/11/2022,Unlv,19,2,Oral Roberts,23,0,"Nicole Leon,  Ken Nash,  Benny Luna"
465,15438,11/7/2022,Unlv,13,0,Pepperdine,19,0,"Denise Lopez,  Jeffrey Benson,  Gabe Beechum"
468,6194,11/12/2022,Southern N.H.,11,0,Dominican (NY),19,0,"Matt Moniz,  Christopher Bohac,  Eric Ferris"
468,6193,11/11/2022,Saint Anselm,18,0,Southern N.H.,12,0,"Ashley Rivera, Ashley Mayerjak, Renee Tourigny"
479,10737,11/12/2022,Nyu,26,0,Alvernia,24,0,"Dershiuan Lin,  Persio Reyes,  Joe Odermatt"
479,10739,11/13/2022,Nyu,20,0,Haverford,24,0,"Kenwyn Christian,  Wylie Gober,  Sharvez Brown"
487,3998,11/7/2022,North Ala.,16,0,Christian Brothers,17,0,"Phebe Smith,  Adam Rider,  Terri Tubbs"
487,3999,11/11/2022,Mississippi St.,13,0,North Ala.,25,1,"Britton Sherry,  Natosha Harris,  Pualani Spurlock-Welsh"
487,4000,11/13/2022,North Ala.,22,0,La Verne,14,0,"Angie Ahrendt,  Brian McCollum,  Tom Barron"
488,4265,11/7/2022,Duke,29,0,N.C. A&T,19,0,"Toni Patillo, Shawn Goode, Talisa Green"
49,12907,11/12/2022,Barry,22,0,Christian Brothers,15,0,"Sonny Schypers, Skylar Collins, Kent Snyder"
490,22294,11/7/2022,NC State,13,0,Quinnipiac,22,0,"Krystle Apellaniz,  Mark Resch,  Fatou Cissoko-Stephens"
490,22295,11/10/2022,NC State,7,0,Elon,17,0,"Whitney Armstrong,  Meadow Overstreet,  Eric Brewton"
490,22296,11/13/2022,NC State,4,0,Mount St. Mary's,14,0,"Ray Bullock Jr.,  Elizabeth Kuzmeski,  Edward Sidlasky"
494,12743,11/11/2022,North Dakota,18,1,Wyoming,22,0,"Mike Kolness,  Chris Cooper,  Amy Krommenhoek"
494,12742,11/7/2022,North Dakota,20,0,Detroit Mercy,17,0,"Alicia Iwakiri,  Nic Thompson,  Kelly Ternes"
496,4479,11/11/2022,North Park,23,1,Beloit,29,0,"Shante Glenn,  Kina Brown,  Dorran Stewart"
496,4481,11/12/2022,North Park,24,1,St. Olaf,19,0,"Rob Jenkins,  Abby Burmeister,  Jen Washo"
499,15749,11/12/2022,Hillsdale,17,0,Truman St.,24,0,"Crathman Stephens,  Kenzie Murray,  Jordan Pingle"
499,15750,11/13/2022,Truman St.,14,0,Ursuline,15,0,"Pat  Campbell,  Stacey Thomas,  Jeff Klaus"
50,8841,11/12/2022,Bates,20,0,Tufts,18,0,"Victor Garay,  James Coffin,  Donald Robberts"
500,12055,11/10/2022,UConn,17,1,Northeastern,27,0,"Ashley Gloss,  Rod Creech,  Fatou Cissoko-Stephens"
500,12054,11/7/2022,Boston U.,18,0,Northeastern,22,0,"Christian Petersonn,  Lynda Kashouh,  Michael Motta"
507,7345,11/12/2022,Minn.-Crookston,18,0,Northwest Mo. St.,11,0,"Nicole  Wagner,  Joel Oswald,  Bryan Rump"
507,7344,11/11/2022,Northwest Mo. St.,23,0,Southwest Minn. St.,20,0,"Doug Viek,  Randy Coil,  Dean Riedel"
514,9884,11/7/2022,Oakland,19,0,Akron,26,0,"Kamaria Douglas,  Brad Duistermars,  Michelle Del Duco"
514,9885,11/12/2022,Oakland,20,0,Central Mich.,31,0,"Linda Miles,  Matt Balster,  Bryan Enterline"
515,6661,11/8/2022,Alma,17,0,Oberlin,23,0,"Jason Wildey,  Amanda Chapman,  Natalie Queen"
515,6662,11/11/2022,Adrian,19,0,Oberlin,16,0,"Kristen Morris,  Chris Jones,  Chris Oakes"
519,8091,11/7/2022,Ohio,22,0,Liu,33,0,"Laura Lewis,  Dash Mcneal,  Zachary Klein"
519,8092,11/10/2022,Longwood,22,0,Ohio,20,0,"John Holmes,  Kyle Pickett,  Kim Crabtree"
526,15293,11/10/2022,Skidmore,16,0,Oneonta,20,0,"Terry Reese,  Charles Rydzak,  Kevin Thomas"
526,15292,11/8/2022,Hartwick,16,0,SUNY Oneonta,18,0,"Keith Batson,  Michael Kaczor,  Mara Wager"
531,5990,11/11/2022,Penn St.-Behrend,21,0,Otterbein,24,0,"Narissa  Williams,  Ivory  Smith,  Jeff Irwin"
531,6088,11/12/2022,Otterbein,20,0,Salisbury,27,0,"Militadis Constantine,  Jon Best,  James Hastings"
533,6684,11/12/2022,Roberts Wesleyan,26,0,Pace,19,0,"Mike LaCroix,  Mark Majewski,  Greg Bishoping"
533,6683,11/11/2022,Daemen,16,0,Pace,16,0,"Reginald Houston,  Mike LaCroix,  Greg Bischoping"
537,13949,11/12/2022,Wingate,18,0,UNC Pembroke,30,0,"Keith Wages,  Utahye Drye,  Elizabeth Crowe"
541,13603,11/10/2022,UC Santa Barbara,19,0,Pepperdine,18,0,"Nicole Leon,  Kyle Bacon,  Benny Luna"
541,13602,11/7/2022,Unlv,13,0,Pepperdine,19,0,"Denise Lopez,  Jeffrey Benson,  Gabe Beechum"
543,6321,11/13/2022,Jefferson,13,0,Queens (NY),12,1,"Jennifer Horvatinovic,  Phil Benson,  Mike Camarota"
543,6320,11/12/2022,Jefferson,9,0,Molloy,18,0,"Chantal Thomas,  Melinda Moore,  Laura Isabelle"
547,16493,11/12/2022,Plattsburgh St.,14,0,Wesleyan (CT),15,0,"Ernie Reid,  Christine Vuong,  Stephen Ansari"
547,16491,11/11/2022,Plattsburgh St.,11,0,Cobleskill St.,18,0,"Ernie Reid,  Stephen Ansari,  Kate Burrell"
547,16490,11/8/2022,Plattsburgh St.,16,0,Clarkson,14,0,"Jamie LaBarge,  Scott Chandler,  Ricky Wilcox"
552,10536,11/11/2022,SUNY Potsdam,17,0,Wesleyan (CT),22,0,"Chaz Loomis, John McKearin, Scott Chandler"
552,10537,11/12/2022,SUNY Potsdam,22,1,Cobleskill St.,19,0,"Greg Tobias,  Scott Chandler,  Kate Burrell"
553,6904,11/13/2022,Washington St.,21,0,Prairie View,16,0,"Sean Martin,  Cheryll Blue,  Kenneth Nash"
557,4518,11/11/2022,Warner Pacific,16,0,Puget Sound,22,0,", , "
557,4520,11/12/2022,Multnomah,20,0,University of Puget Sound,19,0,", , "
560,6601,11/12/2022,Chestnut Hill,17,0,Queens (NY),20,0,"Joi Jefferson,  Michael McGoldrick,  Jorge Martinez"
560,6602,11/13/2022,Jefferson,13,0,Queens (NY),12,1,"Jennifer Horvatinovic,  Phil Benson,  Mike Camarota"
561,5696,11/12/2022,Quincy,22,0,Ursuline,21,0,"Charles Morrison,  Nicole Fisher,  Amanda Chapman"
561,5697,11/13/2022,Hillsdale,13,0,Quincy,18,0,"Kristen Morris,  Joseph Humeston,  Sarah Burgess"
564,12310,11/9/2022,Ramapo College,25,0,St. Elizabeth,28,0,"Ashley Olsen,  Morgan Taylor,  Richard DePena"
564,12314,11/11/2022,Ramapo College,11,0,Old Westbury,14,0,"Carl Small,  Tarif Jackson,  Matt Demm"
566,6943,11/8/2022,Randolph,22,1,Apprentice,24,1,"Cameron Marshall,  Brian Wallace"
566,6944,11/12/2022,Salem,29,0,Randolph,26,0,", , "
568,5564,11/12/2022,Regis (CO),20,0,St. Edward's,22,0,"Glen Dixon,  Trey Bowers,  Chet Martin"
568,5563,11/11/2022,St. Mary's (TX),21,0,Regis (CO),17,0,"Michael Sasaki,  Kara Crosett,  Scotty Hermann"
577,8167,11/12/2022,Lakeland University,22,0,Ripon College,19,0,"Joseph Foster,  Phillix Wynn,  Julie Phillips"
577,8166,11/8/2022,Wis.-Platteville,16,0,Ripon,28,0,"Marissa  Nordschow,  Scott  Fruehling,  Mark Woelfel"
58,11497,11/9/2022,Yeshiva,22,0,Baruch,11,0,"Michael Mei,  Paolo Trujillo,  Mickeni Caldwell"
581,19632,11/12/2022,Rochester,9,0,Messiah,16,0,"Brock Matlock, Ron Macomber Jr., Victor Torregiano"
581,19630,11/11/2022,Rochester,20,0,Texas-Dallas,21,0,"Brandon Long, Brock Matlock, Victor Torregiano"
582,4346,11/8/2022,Rockford,23,0,Lawrence,14,0,"Daniel  West,  Matthew Vanevenhoven,  Paul Novak"
584,10001,11/12/2022,Rollins,24,0,Spring Hill,15,0,"Hannah Matherly,  Janelle Loney,  Brandon Appel"
584,10000,11/11/2022,Rollins,26,0,West Ga.,16,0,"Gilene Cyrius,  Carlos DeJesus,  Giulia D’Ambrosio"
593,11030,11/11/2022,Saint Anselm,18,0,Southern N.H.,12,0,"Ashley Rivera, Ashley Mayerjak, Renee Tourigny"
593,11031,11/13/2022,Saint Anselm,19,0,Dominican (NY),19,0,"Matt Coute, Jacinda Lambert, Ian Carey"
595,8943,11/12/2022,Minn.-Morris,13,0,Saint Benedict,16,0,"LeAnn Hall,  Brad Solberg,  Andrew Dumas"
6,7027,11/13/2022,Nicholls,17,0,Alabama A&M,23,0,"Xavier  Bell,  Sarah Fleming,  Metta Christensen"
6,7026,11/7/2022,Alabama,23,0,Alabama A&M,20,0,"Jody Cantrell,  Frank Steratore,  Angelica Suffren"
60,17345,11/12/2022,Wis.-Eau Claire,11,0,Bethel (MN),16,0,"Cole Tappe,  Derek Wolden,  Kelly Tiernes"
60,17344,11/11/2022,Bethel (MN),26,0,Wis.-Oshkosh,19,0,"Danny DuChene,  Angie Ahrendt,  David Peterson"
601,9259,11/11/2022,St. John Fisher,17,0,Hiram,25,1,"Edwin Yarbrough, Troy Denefield, Althea Bufford"
601,9258,11/8/2022,St. John Fisher,19,0,Buffalo State,23,0,", , "
608,7353,11/12/2022,Saint Leo,16,0,Lee,17,0,"Mevett Wooley,  Marc Ellard,  Ronald Ledington"
608,7352,11/11/2022,Saint Leo,25,1,Alabama Huntsville,21,0,"Willis Giles,  Ronald Ledington,  jarrett Harvey"
611,7996,11/12/2022,St. Mary's (MD),20,0,Pitt.-Bradford,18,0,"Jaren Barbour,  James Poulos,  Patrick Gregg"
611,7994,11/11/2022,St. Mary's (MD),18,0,St. Joseph's (Brkln),12,1,"Kirby Burkholder,  Darwin Thomspon,  Kastine Evans"
614,19645,11/11/2022,St. Norbert College,18,0,Lawrence Univ.,25,0,"Ron Quirk,  Julie Phillips,  Krystal Ellis"
614,19646,11/12/2022,St. Norbert College,15,0,Carthage College,20,0,"Erin Frias,  Dan Schmidt,  Logan Gajewski"
679,14012,11/13/2022,Moravian,24,0,Stevens,34,0,", , "
618,14867,11/12/2022,St. Scholastica,20,0,Northwestern-St. Paul,19,0,"Steve Vekich,  Timothy Widiker,  Tony Schrepfer"
615,18841,11/12/2022,North Park,24,1,St. Olaf,19,0,"Rob Jenkins,  Abby Burmeister,  Jen Washo"
628,6515,11/11/2022,San Fran. St.,18,0,Holy Names,14,1,"Julia Allende,  Chris Hirano,  Kathleen Cassidy"
628,6516,11/12/2022,San Fran. St.,18,0,Academy of Art,10,0,"Mark Harman,  Jerry Ousley,  Tiffany Fong"
637,7879,11/8/2022,Goucher,11,0,Shenandoah,18,0,"Ronald Herbison,  Colleen Dorosh,  Daniel Esteves"
637,7880,11/12/2022,Shenandoah,10,0,Southern Va.,19,0,"Rovelle Brown,  Lynn Craun,  Alex Leap"
638,16932,11/12/2022,Shippensburg,19,0,Bowie St.,33,0,"Christopher Boyer,  Taacha  Brown-Drummond,  Michael Ognosky"
638,16931,11/11/2022,Shippensburg,16,0,Fayetteville St.,25,0,"Sharon  Haddock,  Krista Andrews,  Scott Dutterer"
639,16745,11/10/2022,Siena,29,0,New Hampshire,11,0,"Katlyn Tortorice,  Ashley Rivera,  Timothy  Greene"
639,16746,11/13/2022,Siena,17,0,UAlbany,17,0,"Kenya Kirkland,  Ronnie Stephenson,  Anthony Reddin"
642,6908,11/10/2022,Skidmore,16,0,Oneonta,20,0,"Terry Reese,  Charles Rydzak,  Kevin Thomas"
645,10799,11/12/2022,Fresno Pacific,18,0,Sonoma St.,19,0,"Morgan  Fradley,  James Yee,  Lajwan Robinson"
645,10798,11/11/2022,Dominican (CA),19,0,Sonoma St.,14,1,"Micah Biagi,  Mark Harman,  Gary Hamilton"
646,9956,11/10/2022,Auburn,16,0,South Alabama,24,0,"Natasha Camy,  Roy Gulbeyan,  Katie Lukanich"
646,9955,11/7/2022,South Alabama,12,0,Spring Hill,19,0,"Elicia  Lynch,  Traci Drake,  Tim Buckner"
647,5929,11/12/2022,St. Thomas (MN),10,0,South Carolina St.,10,0,"Angie Ahrendt,  Trevor Kuresa,  Nicole Brannon"
647,5898,11/7/2022,East Carolina,22,0,South Carolina St.,14,0,"Kiara  Negron,  John Holmes,  Rob Fessler"
647,5900,11/12/2022,St. Thomas (MN),10,0,South Carolina St.,10,0,"Angie Ahrendt,  Trevor Kuresa,  Nicole Brannon"
647,5927,11/7/2022,East Carolina,22,0,South Carolina St.,14,0,"Kiara  Negron,  John Holmes,  Rob Fessler"
659,11719,11/12/2022,Southern Ill.,21,0,Middle Tenn.,19,0,"Troy Winders,  Natosha Harris,  Kalei Enterline"
660,14596,11/11/2022,Saint Louis,13,0,Siue,17,0,"Britt White,  Brandon Breese,  Jules Gallien"
660,14597,11/13/2022,Siue,26,1,Eastern Mich.,22,1,"Jocelyn Price,  Courtney Donohue,  Daniel Drake"
661,10638,11/11/2022,Southern Ind.,24,0,Western Ill.,23,1,"Rachael Rayford,  Traci Drake,  Troy Winders"
661,10637,11/7/2022,Southern Ind.,18,0,Oakland City,18,0,"Chris Vanhoose,  Kyente Bryson,  Hannah Ingle"
662,12452,11/12/2022,Southern Me.,12,0,Keene St.,11,0,"Murray,  Underwood,  McLaughlin"
662,12451,11/8/2022,Univ. of New England,11,0,Southern Maine,15,0,"Victor Garay,  Jim Coffin,  Rob Lamarre"
667,11805,11/12/2022,Gonzaga,15,0,Southern Utah,16,0,"Michal Ann Watts,  Steve Belnap,  Darren Krzesnik"
667,11804,11/9/2022,Southern Utah,13,0,Benedictine Mesa,25,0,"Deon  Lewis ,  Sydney  Mott ,  Teresa Turner "
667,11803,11/7/2022,Southern Utah,15,0,New Mexico,18,0,"Katie  Bossenmaier,  Lisa  Bishop ,  Kevin  Kizewski"
669,5899,11/7/2022,Missouri St.,19,0,Missouri,20,0,"Kalee Davidson,  Christopher Cooper,  Michelle  Kramer"
685,6893,11/12/2022,King's (PA),21,0,Susquehanna,20,0,"Kevin Paul,  Duane Gordon,  Aaron Rush"
686,27145,11/12/2022,Swatwbb,25,0,Nazareth,15,0,"Michael Latino,  Tarif Jackson  ,  Mickeni Caldwell"
686,27144,11/11/2022,Hamilton College,16,0,Swatwbb,23,0,"Steven Dunn,  Jr.,  Sean Jones,  Michael Mei"
691,5022,11/11/2022,Kansas City,20,3,Tennessee St.,21,3,"Jared Wilson,  Nicole Brannon,  Missy Brooks"
693,13212,11/9/2022,Belmont,16,0,Chattanooga,24,0,"Nykesha Thompson,  Trey Miles,  Brian Garland"
693,13213,11/12/2022,Chattanooga,19,0,Austin Peay,18,0,"Kyle Adams,  Alganese Carr,  Jody Cantrell"
693,13211,11/7/2022,Chattanooga,15,0,Young Harris,20,0,"Stanley Wormely,  Kristen Jones,  Daniel Drake"
696,5155,11/11/2022,Chadron St.,18,0,Tex. A&M-Kingsville,18,0,"Annie Humphrey,  Landon Arnold,  Chris Packer"
