ncaa_id,game_id,date,home,home_fouls,home_technicals,visitor,visitor_fouls,visitor_technicals,officials
786,15632,11/7/2022,William & Mary,19,0,Navy,25,0,"Joshua Beutell,  Carmen Portorreal,  Don Cummiskey"
786,15633,11/11/2022,Vcu,17,0,William & Mary,14,0,"Colleen Thompson,  Roy Jackson,  Tom Danaher"
774,14054,11/7/2022,Western Mich.,19,0,Loyola Chicago,20,0,"Jason Wildey,  Colleen Thompson,  Aaron  Brooks"
774,14055,11/13/2022,Michigan St.,21,0,Western Mich.,15,0,"Brad Maxey,  Angie Enlund,  Tim Daley"
2915,9056,11/7/2022,Youngstown St.,21,0,Wofford,25,0,"Steve Lazroff,  Althea Bufford,  Chris Oakes"
2915,9057,11/10/2022,Clemson,9,0,Wofford,11,0,"Courtney Robinson,  Kristi Vera,  Daryl Humphrey"
768,19438,11/10/2022,West Virginia,19,0,USC Upstate,21,0,"Adrienne Gilmore-Nichols,  Scott Yarbrough,  Felicia Grinter"
260,8577,11/10/2022,Gonzaga,11,0,Long Beach St.,19,0,"Mjumbe  Williams,  Karen Lasuik,  Michael Price"
260,8578,11/12/2022,Gonzaga,15,0,Southern Utah,16,0,"Michal Ann Watts,  Steve Belnap,  Darren Krzesnik"
100,5051,11/11/2022,Cui,17,0,Cal State LA,19,0,"April Harding,  Brenda Castillo,  Alicia  Iwakiri"
100,5052,11/12/2022,Biola,20,0,Cal State LA,15,0,"Ben Leech,  Jeff Benson,  Marissa Cannon"
101,15578,11/7/2022,California,16,0,Csun,23,0,"Sydney  Mott,  Karen Lasuik,  Robert Scofield"
101,15695,11/9/2022,Stanford,10,0,Csun,28,0,"Felecity Willis,  Tyler Trimble,  Brian Woods"
1010,6919,11/12/2022,Central Wash.,10,0,Stanislaus St.,13,0,"Hailey Collins,  Blake Welsh,  Bryson Smith"
1010,6918,11/11/2022,Cal St. East Bay,28,1,Central Wash.,11,0,"Hailey  Collins,  Bryson Smith,  Erik Johnson"
1012,4226,11/11/2022,Chadron St.,18,0,Tex. A&M-Kingsville,18,0,"Annie Humphrey,  Landon Arnold,  Chris Packer"
1012,4227,11/12/2022,Chadron St.,20,0,Tex. A&M Int'l,27,1,"Katlelynn Hall,  Dillon Fuller,  Ted Nieman"
1015,7884,11/11/2022,Lynn,19,2,Christian Brothers,15,0,"Madison Thompson,  Valerie Webb,  Greg Pigott"
1015,7885,11/12/2022,Barry,22,0,Christian Brothers,15,0,"Sonny Schypers,  Skylar Collins,  Kent Snyder"
1028,8980,11/11/2022,Concord,21,0,Clarion,24,1,"Daniel Chandler,  Justin Ehrman,  Kara Hunter"
10411,5323,11/7/2022,USC Upstate,16,0,Southern Wesleyan,18,0,"Crista Couch,  Elizabeth Crowe,  Dan Outlaw"
10411,5325,11/10/2022,West Virginia,19,0,USC Upstate,21,0,"Adrienne Gilmore-Nichols,  Scott Yarbrough,  Felicia Grinter"
1066,7051,11/8/2022,Edgewood,11,0,Wartburg,17,0,"Cade Murray,  Franklin Searer,  Matt Andrews"
1068,8009,11/7/2022,Wake Forest,18,0,Elon,14,1,"Felicia Young,  Edward Sidlasky,  Karen Preato"
1068,8010,11/10/2022,NC State,7,0,Elon,17,0,"Whitney Armstrong,  Meadow Overstreet,  Eric Brewton"
1068,8011,11/13/2022,Elon,26,1,High Point,12,0,"Alex Leap,  Kristie Weed,  Norma Jones"
1071,8126,11/12/2022,Emporia St.,12,0,Henderson St.,12,0,"Jake Black,  Mike Lewis,  Scott Klomfas"
1071,8125,11/11/2022,Harding,12,0,Emporia St.,14,0,"Lauren Thomas,  Shaun Robinson,  Montrell Simmons"
1076,8431,11/12/2022,Fairmont St.,18,0,Clarion,23,1,"Mack Akers,  Timmy Rein,  Dustin Smith"
1076,8430,11/11/2022,Fairmont St.,19,0,Winston-Salem,26,0,"Tara Gallupe,  Chris Bonchosky,  Alex Louk"
1083,4243,11/11/2022,Eastern N.M.,16,0,Fort Lewis,27,1,"Yolanda Osuna,  Doug Bolich,  Nate Acosta"
1083,4244,11/12/2022,Fort Lewis,26,0,Western N.M.,19,0,"Bobby Sitton,  Joshua Gregg,  Doug Bolich"
1085,9866,11/12/2022,Coker,24,0,Francis Marion,21,0,"Libya Rentz,  Joe Spencer,  Stephen Peay"
1092,7346,11/7/2022,Clemson,22,0,Gardner-Webb,22,0,"Roy Jackson,  Whitney Armstrong,  Carla Fountain"
1094,5423,11/13/2022,George Fox,14,0,Pomona-Pitzer,17,0,"John Gullic,  Aaron Miyasaki,  Aaron Haugen"
10972,5015,11/8/2022,Chatham Cougars,17,0,Penn State Altoona,21,0,"Eric Pethtel,  Bridget Borelli,  David Lawrence"
1098,2088,11/13/2022,Glenville State,18,0,Livingstone College,20,0,"Jason Wilkinson,  Ash Greene,  Lucas Tuggle"
11,6879,11/6/2022,La Sierra,14,0,Alaska-Anchorage,25,1,", , "
11,6880,11/13/2022,Hawaii Pacific,18,0,Alas. Anchorage,30,0,"Akira Usami,  Steve Piercy,  Tim Tamashiro"
1115,4553,11/11/2022,Wheaton (IL),16,0,Hanover,14,0,"Dan Fisher,  Erin Frias,  Paul Novak"
1115,4554,11/12/2022,Elmhurst,21,0,Hanover,13,0,"Phillip Crawford,  Johnny Jackson,  Dorran Stewart"
1116,13565,11/11/2022,Harding,12,0,Emporia St.,14,0,"Lauren Thomas,  Shaun Robinson,  Montrell Simmons"
112,9111,11/13/2022,Northern Ariz.,16,0,UC San Diego,22,0,"Eddie  Zavala,  Esther Hsu,  Karen Lasvik"
112,9110,11/7/2022,California Baptist,21,0,UC San Diego,22,0,"Chaka Wade,  Kathleen Cassidy,  Shelley Nakasone"
1123,5729,11/11/2022,Henderson St.,22,0,Mo. Southern St.,16,0,"Tammy Sousa,  Barry Hickenbotham,  Scott Starkey"
1124,5206,11/13/2022,Hendrix,10,0,Southwestern,20,0,"R-Lauren Thomas,  U1- Blake Thomas,  U2- Glenn McDay"
1124,5205,11/11/2022,Hendrix,19,0,Principia,18,0,"Rieley Hooten,  David Porter,  Melissa Mitchell"
113,4958,11/13/2022,Whittier,14,0,UC Santa Cruz,10,0,"Natalie Logue,  Juchell Wardlow,  Nate Crawford"
11403,6359,11/11/2022,Lubbock Christian,13,0,Colo. Christian,22,0,"Alika Arisumi,  Travis Clark,  Randall Arbuckle"
11403,6360,11/12/2022,Colo. Christian,21,0,UT Tyler,26,1,"Destry Dacus,  LeAndre Benton,  Travis Clark"
11416,16139,11/12/2022,Colorado Mesa,17,0,Tex. Permian Basin,18,0,"Landon Arnold,  Rory Robinson,  Jacob Finn"
11416,16140,11/11/2022,Colorado Mesa,17,0,West Tex. A&M,18,0,"Hayden  Peters,  Craig Thompson,  Ike Jessee"
11504,10649,11/13/2022,James Madison,20,0,Queens (NC),19,0,"Chastity Taylor,  Kara Hunter,  Timothy Greene"
11504,10647,11/7/2022,Queens (NC),15,0,Pfeiffer,15,0,"Walt Quillers,  Al Gray,  Dominique Dawson"
1156,7056,11/11/2022,Neb.-Kearney,11,0,Minn.-Crookston,8,0,"Jason Lafasciano,  Jake Dilsaver,  Rodney Palen"
1156,7153,11/6/2022,West Tex. A&M,15,0,Neb.-Kearney,14,0,"Drew Roberts,  Christopher Cooper,  Nick Marshall"
1156,7054,11/5/2022,Neb.-Kearney,12,0,Southern Nazarene,18,0,"Jeremy McHugh,  Allyn Richardson,  Michelle Kramer"
1164,7224,11/9/2022,Lakeland University,22,0,Wisconsin-Oshkosh,15,0,"Brian Kenney,  Timothy Duffy,  Fritz Richter"
1164,7225,11/12/2022,Lakeland University,22,0,Ripon College,19,0,"Joseph Foster,  Phillix Wynn,  Julie Phillips"
117,4153,11/12/2022,Capital,19,0,Kenyon,16,0,"Bob Balak,  Thurmann Leggs,  Dave Gross"
1174,14799,11/12/2022,Converse,19,0,Limestone,20,0,"Bradley Salter, Ken Pelanda, Al Gray"
1174,14798,11/11/2022,King (TN),16,0,Limestone,13,0,"Chad Tucker, Nate Walker, LaSonia Baker"
1179,13673,11/12/2022,Linfield,20,0,Oregon Tech,14,0,"Josh Spirlin,  Michael Thorner,  Michael Hanson"
118,8696,11/12/2022,Carleton,18,0,Luther,14,0,"Lacy Masden,  Chris Katke,  Teron Buford"
11839,6091,11/8/2022,Carlow,18,0,Pitt Greensburg,15,0,"Brenna Burry,  Jon Best,  Justin Ehrman"
19,6440,11/11/2022,John Carroll,16,0,Allegheny,25,0,"Pat Campbell,  Tory Capasso,  Kristen Csontos"
19,6439,11/8/2022,Allegheny,16,0,Carnegie Mellon,13,0,"Ron Leeds,  Dara Loftion,  Ronald Connelly"
1240,5349,11/12/2022,MSU Moorhead,15,0,Central Mo.,11,0,"Eric  Guler,  Kevin Sundre,  Michael Kolness"
1240,5347,11/11/2022,MSU Moorhead,12,0,Rogers St.,16,0,"Nic Thompson,  Josh Junker,  LeAnn Hall"
1245,5174,11/11/2022,Mount Olive,23,0,Tusculum,11,0,"Utahya Drye,  Antoine Love,  Dana Moore-Lopez"
1245,5173,11/12/2022,Catawba,14,0,Mount Olive,18,0,"Apasra Christian,  Larry Mellinger,  Desmond Sullivan"
1254,10886,11/8/2022,Arcadia,23,0,Neumann,17,0,"Anthony Stevenson,  Alyssa Hahn,  Aaron Rush"
1254,10887,11/11/2022,Goucher,22,0,Neumann,19,0,"Jennifer Horvatinovic,  Chantal Thomas,  Jeff Ralls"
1254,10888,11/12/2022,Mount Aloysius,21,0,Neumann,17,0,"Linwood Floyd,  Tonisha Montgomery,  Darwin Thompson"
1266,12863,11/12/2022,Northern St.,18,0,Rogers St.,24,0,"Eric Ringeisen,  Spencer Halvorson,  Jim Erzar"
1266,12864,11/11/2022,Central Mo.,18,0,Northern St.,20,0,"Danny  Weigel,  Chris Heise,  Ben Franson"
1267,6257,11/8/2022,Wis.-Stevens Point,12,0,Northland,22,1,"Mark Sojkowski,  Timothy Duffy,  Brian Kenney"
1267,6259,11/12/2022,Finlandia,23,0,Northland,18,0,"Jim Weiler, Hunter Rautiola, Dave Dow"
1274,7651,11/12/2022,Northwest Nazarene,21,0,Cal St. East Bay,16,0,"Amirah Leonard,  Sheldon Mallory,  Steven Landro"
1274,7649,11/11/2022,Northwest Nazarene,22,0,Stanislaus St.,19,0,"Hailey Colllins,  Amirah Leonard,  Kenny Thomas"
130,5032,11/11/2022,Central Mo.,18,0,Northern St.,20,0,"Danny  Weigel,  Chris Heise,  Ben Franson"
130,5033,11/12/2022,MSU Moorhead,15,0,Central Mo.,11,0,"Eric  Guler,  Kevin Sundre,  Michael Kolness"
1305,7059,11/12/2022,Cairn,14,0,Lancaster Bible,12,0,"Daniel Stefankiewicz,  Phil Benson,  Stephen Dunn Jr."
1314,4088,11/12/2022,Southwestern Okla.,19,0,Pittsburg St.,12,0,"Jeremy McHugh,  Josh Mara,  Rich Brewer"
1314,4087,11/11/2022,Pittsburg St.,16,0,Okla. Baptist,13,0,"Jocelyn Price,  Todd  Dahlof,  Larry Hare"
296,11283,11/13/2022,Benedictine (IL),24,0,UChicago,23,0,"Bob Jenkins,  Ashley Logan,  Kenny Williams"
1318,15787,11/11/2022,Adelphi,19,1,Post,11,0,"Pat DeForte,  Barry Lastra,  Andre Smith"
1328,5964,11/12/2022,Wis.-Parkside,24,1,Rockhurst,28,1,"Brad Duistermars,  Justin Fahy,  Tom Hallead"
1328,5963,11/11/2022,Walsh,24,0,Rockhurst,18,0,"Mark Sojkowski,  Mark Woelfel,  Derrick McCullough"
1334,7253,11/12/2022,Regis (CO),20,0,St. Edward's,22,0,"Glen Dixon,  Trey Bowers,  Chet Martin"
1334,7252,11/11/2022,Colo. Sch. of Mines,21,0,St. Edward's,14,0,"Brette Hayward,  Simona Petronyte Sandoval,  Fred Steubing"
1343,5287,11/13/2022,Saint Martin's,14,0,Cal Poly Humboldt,11,0,"Candace Horn,  Matthew Head,  Kaitlynn Bunger"
1343,5286,11/12/2022,Saint Martin's,28,0,Capilano (CAN),23,0,"Sarah Sower,  Josiah McCallister,  Aaron Haugen"
1346,6339,11/12/2022,St. Mary's (TX),12,0,Colo. Sch. of Mines,25,0,"Paige Parliament,  Doug  Williams,  Michael Urdiales"
1346,6338,11/11/2022,St. Mary's (TX),21,0,Regis (CO),17,0,"Michael Sasaki,  Kara Crosett,  Scotty Hermann"
1376,9579,11/11/2022,Upper Iowa,24,0,Southern Ark.,17,0,"Nick Pack,  Jim  Harding,  MJ Wagenson"
139,14549,11/8/2022,Chris. Newport,21,0,Averett,20,0,"DJ Chapman,  Byron Purnell,  Melquan Williams-Morris"
1395,6134,11/9/2022,Tarleton St.,11,1,Arlington Baptist,19,0,"DeAnna Butler,  Amy Krommenhoek,  Kenneth Nash"
1395,6135,11/12/2022,Tarleton St.,20,0,North Texas-Dallas,24,0,"Arthur Green,  Kevin Kizewski,  Chris Sauceda"
1454,4127,11/10/2022,Whitworth,21,0,Walla Walla,18,0,"Philip Hinrichs,  Sabrina Earle,  Jayson Loffredi"
1433,5136,11/11/2022,Wayne St. (NE),33,0,Newman,27,0,"Jeff  Westover,  Greg Durham,  Gerry Miller"
1434,8290,11/8/2022,Cwru,21,0,Waynesburg,18,0,"Joseph Humeston,  Rick Macer & Daniel Potopsky"
1438,4963,11/12/2022,West Liberty,25,0,Mercyhurst,35,0,"Brittany  Harris,  Dash McNeal,  Eric Pethtel"
1439,3257,11/13/2022,West Virginia State,21,0,West Chester (PA),16,0,"Pete Kowalski,  Teuvyn Page,  Dash McNeal"
1446,5935,11/13/2022,Western Ore.,13,0,Capilano (CAN),17,0,"Sarah Sowers,  Sean Martin,  Maggie DeWall"
1446,5934,11/12/2022,Cal Poly Humboldt,23,0,Western Ore.,19,0,"Fernando Lira,  Erik Johnson,  Candace Horne"
121,9382,11/12/2022,St. Norbert College,15,0,Carthage College,20,0,"Erin Frias,  Dan Schmidt,  Logan Gajewski"
121,9381,11/11/2022,UW-La Crosse,18,0,Carthage College,17,0,"Adam Swanepoel,  Michael Gotsch,  Erik Jones"
123,9767,11/8/2022,Castleton,18,0,Norwich,16,0,"Kate Burrell,  Jerry Burgess,  George Dyer"
123,9768,11/12/2022,Castleton,19,0,Thomas (ME),21,0,", , "
123,9769,11/13/2022,Castleton,12,0,Me.-Farmington,21,0,", , "
146,8417,11/8/2022,Plattsburgh St.,16,0,Clarkson,14,0,"Jamie LaBarge,  Scott Chandler,  Ricky Wilcox"
1462,9681,11/12/2022,Wingate,18,0,UNC Pembroke,30,0,"Keith Wages,  Utahye Drye,  Elizabeth Crowe"
151,3659,11/12/2022,Colby,25,0,Rivier,18,0,", , "
155,23806,11/12/2022,St. Mary's (TX),12,0,Colo. Sch. of Mines,25,0,"Paige Parliament,  Doug  Williams,  Michael Urdiales"
155,23805,11/11/2022,Colo. Sch. of Mines,21,0,St. Edward's,14,0,"Brette Hayward,  Simona Petronyte Sandoval,  Fred Steubing"
16,5964,11/9/2022,Moravian University,24,0,Albright College,12,0,"Sharvez Brown,  Bobby Hoppe,  Stacey Smalls"
16142,16465,11/12/2022,SUNY New Paltz,18,0,Misericordia,16,0,"Andre Smith,  Kamal Pasha,  Jessica Smith"
163,5112,11/12/2022,Rensselaer,25,0,Connecticut Col.,20,0,"Kerry Lang,  Bill Tarpey,  Thomas Benning"
163,5111,11/11/2022,Maine Maritime,18,0,Connecticut Col.,21,0,"William Dugan Junior,  Kevin Lecuyer,  Ashley Osinubi"
166,4996,11/12/2022,Central (IA),21,0,Cornell College,19,1,"Mark VandeHaar,  Joseph Lopez,  LaWayne Roger"
174,8141,11/11/2022,Indiana (PA),13,0,Davis & Elkins,25,0,"Charlene Lybbert,  Christopher Boyer,  Michael Ognosky"
179,5677,11/12/2022,Wm. Paterson,14,0,Delaware Valley,24,0,"Lauren Dottin,  Taj Goodlow,  Chad Johnson"
179,5676,11/11/2022,Gwynedd Mercy University,19,1,Delaware Valley,23,0,"Cynthia Do,  Lamar Diamond,  Christian Cintron"
18,8316,11/8/2022,Alfred,19,0,Morrisville St.,18,0,"Paul C,  Mike S,  Mike L"
181,13442,11/12/2022,Delta St.,18,1,LeMoyne-Owen,24,1,"Kristen Jones,  Adam Welch,  Brian Kilgore"
181,13441,11/11/2022,Delta St.,12,0,Tuskegee,14,0,"Anthony  Hall,  Tony Lofton,  Tim Hackett"
183,12608,11/11/2022,Denver,21,0,Northern Colo.,13,0,"Hayley Sprenger,  Faye Muller,  Tim Devlin"
183,12607,11/7/2022,Denver,17,0,Air Force,24,0,"Genesis Perrymond,  Amy Krommenhoek,  Charles Stein"
190,11635,11/9/2022,Rutgers University-Camden,10,0,Drew,14,0,"Mike Camarota,  Greg Tobias,  Amanda Feldman"
190,11636,11/11/2022,Drew,24,0,Penn St.-Lehigh Val.,24,1,"Brian Anthony,  Melinda Moore,  Mark Horn"
19117,6164,11/13/2022,Gannon,15,0,Salem (WV),19,0,"Narissa Willaims,  Whitney Humphrey,  Ken McClain"
192,1439,11/8/2022,Dubuque,24,0,Marian (WI),18,0,"Caleb Nuerink,  Josh Ragar,  Rachel Lenz"
192,1440,11/11/2022,Dubuque,21,0,Eureka,18,0,"Andy Koehn,  Keith Lehrman,  Darla Brendemuehl"
195,4719,11/12/2022,Muskingum,14,0,Earlham,16,0,"David Curley,  Scott Soha,  Alex Gebers"
196,12649,11/10/2022,East Carolina,24,0,Wake Forest,24,0,"Tasha Smith,  Bobby Ray,  Tom Danaher"
196,12648,11/7/2022,East Carolina,22,0,South Carolina St.,14,0,"Kiara  Negron,  John Holmes,  Rob Fessler"
196,12650,11/13/2022,East Carolina,20,0,Uncw,19,0,"Deanna Jackson,  Timothy Bryant,  Bryan Burnette"
197,9838,11/12/2022,East Stroudsburg,13,0,Virginia Union,19,0,"Matt Beltz,  Kareem Smith,  Robert Clark"
199,9670,11/7/2022,Tex. A&M-Commerce,15,0,North Texas-Dallas,25,0,"Bonnie Hainline,  Michael Aguilar,  Shandra Twine"
199,9703,11/12/2022,UT Arlington,21,0,Tex. A&M-Commerce,24,0,"Simona Sandoval,  Ashley Birch,  Julie Krommenhoek"
200,6102,11/12/2022,Eastern Connecticut,16,0,Babson College,19,0,"Jenna Buffi,  Chad Cooney,  Jerry Withinton"
205,9218,11/12/2022,Chaminade,17,2,Mont. St. Billings,14,0,"Karen Poon,  Brian Yamasaki,  Tim Tamashiro"
205,9219,11/13/2022,Hawaii Hilo,22,1,Mont. St. Billings,14,0,"Stefan Fromm,  Patrick  Black-Santiago,  Mason Souza"
205,9217,11/11/2022,Hawaii Pacific,25,0,Mont. St. Billings,21,0,"Akira Usami,  Kevin Hirayama,  Gabe Heres"
206,12581,11/12/2022,N.M. Highlands,21,0,Eastern N.M.,21,1,"Carmela Garcia,  Yolanda Osuna,  David Montoya"
206,12580,11/11/2022,Eastern N.M.,16,0,Fort Lewis,27,1,"Yolanda Osuna,  Doug Bolich,  Nate Acosta"
208,7701,11/11/2022,Valdosta St.,21,0,Eckerd,21,0,"Tim Debruler,  Blake Kerns,  Steve  Barringer"
211,9279,11/13/2022,Franklin & Marshall,15,0,Elizabethtown,11,0,"Chantal Thomas,  Craig Morancie,  Lamar Diamond"
211,9278,11/12/2022,Elizabethtown,16,0,Lycoming,20,0,"Amanda Feldman,  Shelbey Lorenzetty,  Carolyn Allen"
211,9277,11/8/2022,McDaniel,25,0,Elizabethtown,13,0,"Daryl  Wedge, Kelly Mitchell, Walter Connor"
212,6138,11/8/2022,Aurora,20,0,Elmhurst,21,0,"Jamila Wilson,  Shante Glenn,  Cria Haro"
212,6139,11/11/2022,Wis.-Platteville,17,0,Elmhurst,14,0,"Paul Frerking,  Alicia Shivers,  Alissa Purko"
212,6140,11/12/2022,Elmhurst,21,0,Hanover,13,0,"Phillip Crawford,  Johnny Jackson,  Dorran Stewart"
213,13051,11/8/2022,Penn College,13,0,Elmira,13,0,", , "
21323,7826,11/12/2022,Chestnut Hill,17,0,Queens (NY),20,0,"Joi Jefferson,  Michael McGoldrick,  Jorge Martinez"
21323,7827,11/13/2022,Chestnut Hill,21,0,Molloy,21,0,"Kristie Watkins-Day,  Meg Dallmann,  Kelly Callahan"
228,3976,11/11/2022,South Fla.,9,0,Florida A&M,15,0,"Tommi Paris,  Whitney Armstrong,  Teresa Stuck"
228,3975,11/7/2022,Florida,17,0,Florida A&M,19,0,"Saif Esho,  Brian Hall,  Felicia Grinter"
23,4960,11/9/2022,DePaul,6,0,American,20,1,"Lauren Niemiera,  Rod Creech,  Brandon Enterline"
231,10697,11/13/2022,Fiu,18,0,Fgcu,16,0,"Charles Stein,  Kiesha Brown,  Chris Sauceda"
231,10695,11/9/2022,Fiu,26,0,N.C. Central,33,0,"Sam Crawford,  Heather Marshall,  Xioamara Cruz-Johnson"
23121,7181,11/12/2022,Texas-Dallas,14,0,Johns Hopkins,17,0,"Paul Cone Jr.,  Brandon Long,  Robert McDow"
23121,7180,11/11/2022,Rochester (NY),20,0,Texas-Dallas,21,0,"Brandon Long,  Brock Matlock,  Victor Torregiano"
233,19252,11/12/2022,Alabama Huntsville,11,0,Fla. Southern,18,0,"Justin Vermillion,  Jelisa Caldwell,  Jelisse Oliver"
233,19251,11/11/2022,Fla. Southern,11,0,Lee,22,0,"Jelissa Oliver,  Heather Marshall,  Jessyca Christopher"
235,25349,11/13/2022,Florida,19,0,UNC Asheville,19,0,"Ify Seales,  Maj Forsberg,  Kevin Pethtel"
235,25348,11/7/2022,Florida,17,0,Florida A&M,19,0,"Saif Esho,  Brian Hall,  Felicia Grinter"
246,10123,11/13/2022,Gannon,15,0,Salem (WV),19,0,"Narissa Willaims,  Whitney Humphrey,  Ken McClain"
246,10124,11/12/2022,Gannon,16,0,Notre Dame (OH),19,0,"Narissa Williams,  Kristen Csontos,  Scott Dutterer"
247,3951,11/12/2022,SUNY Geneseo,6,0,Keuka,7,0,"R 3,  R 2,  R 1"
247,3950,11/9/2022,Rit,23,0,SUNY Geneseo,11,0,"Steven Call,  Mike LaCroix,  Greg Bischoping"
25,5153,11/12/2022,Western Colo.,18,1,Angelo St.,17,0,"Tammy Spencer,  Jeff Goto,  Denise Lopez"
25,5152,11/11/2022,Angelo St.,23,0,MSU Denver,25,0,"Michaela Fox,  Jeff Gotto,  Denise Lopez"
259,10235,11/13/2022,Amherst,23,0,Rowan,17,0,"Christian Peterson,  Kevin Thompson,  C. Zazzaro-Straney"
259,10092,11/12/2022,Springfield,12,0,Rowan,23,0,"Jerry Burgess,  James Mento,  Suzanne Tiranno"
261,5864,11/11/2022,Arizona St.,10,0,Grambling,21,0,"Rochelle Bennett,  Corey Long,  Anita Ortega"
261,5865,11/12/2022,Grand Canyon,14,0,Grambling,17,1,"Chaka Wade,  Nicole Leon,  Robert Scofield"
261,5863,11/7/2022,Tulane,12,0,Grambling,15,0,"Alganese Gaston-Carr,  Issac Johnson,  Mark McClenney"
26172,6974,11/10/2022,Texas A&M,22,0,A&M-Corpus Christi,18,0,"Cara Seggie,  Kaz Beverley,  Karen Preato"
26172,6973,11/7/2022,Texas Tech,18,0,A&M-Corpus Christi,20,0,"Tiffany  Bridges,  Josh Howell,  Metta  Christensen"
262,11669,11/12/2022,Maryville (MO),23,0,Grand Valley St.,20,0,"Sean Carver,  Reba McBurrows,  Shane Bennett"
262,11670,11/11/2022,Mo.-St. Louis,16,0,Grand Valley St.,8,0,"Reba McBurrows, Keith Kee, Jason Schmitz"
264,18487,11/12/2022,Neb. Wesleyan,26,0,Grinnell,16,0,Tyler Eason
264,18486,11/8/2022,Grinnell,14,0,Buena Vista,17,0,"Mark Vande Haar,  Shane Svoboda,  Keith Lehrman"
30084,2468,11/12/2022,Concordia Wisconsin,17,0,Geneva,24,0,"Rollie Madison,  Tom Berry,  Tim Fekete"
30084,2518,11/11/2022,Hope,17,0,Geneva,27,0,"Brad Duistermars,  Andy Mckellar,  Thomnas Starks"
2699,15709,11/7/2022,Iupui,22,0,Uic,14,0,"Dorran Stewart,  Monique Davis,  Troy Ramey"
2699,15710,11/10/2022,Louisville,21,0,Iupui,17,1,"Brandon Enterline,  Teresa Stuck,  Denise Brooks"
2699,15711,11/13/2022,Butler,17,0,Iupui,8,0,"David Rafalski,  Linda Miles,  John Capolino"
2707,7314,11/7/2022,Kansas City,28,0,Westminster (MO),32,0,"Jocelyn Price,  Payton Everett,  Ty Bills"
2707,7315,11/11/2022,Kansas City,20,3,Tennessee St.,21,3,"Jared Wilson,  Nicole Brannon,  Missy Brooks"
2707,7316,11/13/2022,Kansas City,23,0,Utep,12,0,"Kalee Davidson,  Christopher Cooper,  Michelle Kramer"
2720,6519,11/12/2022,Lubbock Christian,16,1,CSU Pueblo,23,1,"Kelsey Curry,  Corey Malone,  Michael Nkollo"
2720,6518,11/11/2022,CSU Pueblo,10,0,UT Tyler,9,0,"Tommy Prosise,  Michael Nkollo,  Corey Malone"
273,6396,11/12/2022,Hartwick,15,0,Muhlenberg,17,0,"David  Dence,  Gregory Teeter,  Charles Rydzak"
273,6394,11/11/2022,SUNY New Paltz,6,0,Hartwick,14,1,"Luis Torres,  Christopher Osterhoudt,  Paolo Trujillo"
273,6393,11/8/2022,Hartwick,16,0,SUNY Oneonta,18,0,"Keith Batson,  Michael Kaczor,  Mara Wager"
2751,6293,11/13/2022,Claremont-M-S,20,1,Pacific (OR),18,0,"Michael Ann Watts,  Jessica Wilkinson,  Michael Hanson"
2751,6292,11/12/2022,Pacific (OR),10,0,Pomona-Pitzer,11,0,"Nicholas Mitch,  Brian  Robinson,  Maggie DeWall"
2759,4610,11/12/2022,Western Colo.,18,1,Angelo St.,17,0,"Tammy Spencer,  Jeff Goto,  Denise Lopez"
2759,4609,11/11/2022,Western Colo.,17,0,Texas Woman's,9,0,"Nicholas Brigata,  David Malmquist,  David  Montana"
27854,4892,11/11/2022,Neb.-Kearney,11,0,Minn.-Crookston,8,0,"Jason Lafasciano,  Jake Dilsaver,  Rodney Palen"
27854,4893,11/12/2022,Minn.-Crookston,18,0,Northwest Mo. St.,11,0,"Nicole  Wagner,  Joel Oswald,  Bryan Rump"
267,4639,11/12/2022,Vassar College,16,0,Hamilton College,13,0,"Luis Torres,  Kristin Kenny,  Morgan Taylor"
267,4638,11/11/2022,Hamilton College,16,0,Swatwbb,23,0,"Steven Dunn,  Jr.,  Sean Jones,  Michael Mei"
2814,19213,11/12/2022,Washburn,12,0,Okla. Baptist,16,0,"Payton Everett,  Jason  Lafaciano,  Rodney Palen"
2814,19205,11/11/2022,Washburn,19,0,Southwestern Okla.,18,0,"Kerry Nichols,  Tracy Mulligan,  John Adams"
281,4689,11/11/2022,St. John Fisher,17,0,Hiram,25,1,"Edwin Yarbrough,  Troy Denefield,  Althea Bufford"
291,4840,11/13/2022,Saint Martin's,14,0,Cal Poly Humboldt,11,0,"Candace Horn,  Matthew Head,  Kaitlynn Bunger"
291,4714,11/12/2022,Cal Poly Humboldt,23,0,Western Ore.,19,0,"Fernando Lira,  Erik Johnson,  Candace Horne"
292,6374,11/8/2022,Tcnj,13,0,Hunter,15,0,"Deja Rawls,  Daniel Stefankiewicz,  Tracy Stamper"
292,6375,11/11/2022,Pitt.-Bradford,24,0,Hunter,14,0,"Shelby Lorenzetty,  Tobey Kass,  Tammy Holman"
292,6403,11/11/2022,Pitt.-Bradford,24,0,Hunter,14,0,"Shelby Lorenzetty,  Tobey Kass,  Tammy Holman"
294,6464,11/7/2022,Idaho St.,13,0,Westminster (UT),17,0,"Nicholas Mitch,  Teresa Olsen,  Rick Thorne"
294,6465,11/12/2022,Southern California,17,0,Idaho St.,18,0,"Ashley Ellis,  Marc Merritt,  MIchael Price"
3,10282,11/11/2022,Adelphi,19,1,Post,11,0,"Pat DeForte,  Barry Lastra,  Andre Smith"
30,6928,11/10/2022,Louisiana Tech,14,0,Arkansas St.,14,0,"Travis Jones,  Sarah Fleming,  Chaney Muench"
300,14434,11/11/2022,Concordia Wisconsin,12,0,Ill. Wesleyan,18,0,"Brad Duistermas,  Andy McKellar,  Thomas Starks"
300,14435,11/12/2022,Hope,17,0,Ill. Wesleyan,18,0,"Randy Reese,  Tim Swain,  Jake Rolff"
30013,5391,11/12/2022,Saint Leo,16,0,Lee,17,0,"Mevett Wooley,  Marc Ellard,  Ronald Ledington"
30013,5390,11/11/2022,Fla. Southern,11,0,Lee,22,0,"Jelissa Oliver,  Heather Marshall,  Jessyca Christopher"
30028,7243,11/12/2022,Colo. Christian,21,0,UT Tyler,26,1,"Destry Dacus,  LeAndre Benton,  Travis Clark"
30028,7242,11/11/2022,CSU Pueblo,10,0,UT Tyler,9,0,"Tommy Prosise,  Michael Nkollo,  Corey Malone"
30031,9609,11/12/2022,St. Scholastica,20,0,Northwestern-St. Paul,19,0,"Steve Vekich,  Timothy Widiker,  Tony Schrepfer"
30032,3943,11/8/2022,Finlandia,17,0,Wis.-Superior,13,0,"Jim Weiler, Brian Rimppla, Rob Fay"
30032,3942,11/12/2022,Finlandia,23,0,Northland,18,0,"Jim Weiler, Hunter Rautiola, Dave Dow"
30036,3320,11/11/2022,Arcadia,22,0,Mount Aloysius,19,0,"Joe Toren,  Tiffanie Drayton,  Nate Dotson"
30036,3321,11/12/2022,Mount Aloysius,21,0,Neumann,17,0,"Linwood Floyd,  Tonisha Montgomery,  Darwin Thompson"
30038,6082,11/12/2022,Calvin,21,0,Bethany Lutheran,26,0,"Erik Jones,  Tyler Richards,  Darla Brendemuehl"
30038,6081,11/11/2022,DePauw,23,0,Bethany Lutheran,20,0,"Cris Haro,  Shelley Dietz,  Jennifer Washo"
30039,3643,11/10/2022,Central (IA),11,0,North Central (MN),22,0,"Mark Vande Haar,  Rachel Lenz,  Tyler Eason"
30047,5420,11/8/2022,Keystone,23,0,Wilkes,27,1,"Larry Otis,  Camille Johnson,  Matthew Dennis"
30050,7635,11/12/2022,Tiffin,12,0,Ill. Springfield,23,0,"Ivan  Fulten,  Mike  McGough,  Pat Campbell"
30054,6351,11/11/2022,Wayne St. (NE),33,0,Newman,27,0,"Jeff  Westover,  Greg Durham,  Gerry Miller"
30055,7797,11/12/2022,Cal St. Monterey Bay,19,0,Holy Names,29,1,"Jay Ferrick,  Sarah Barr,  Dominique Hunter"
30055,7796,11/11/2022,Cal St. Monterey Bay,21,0,Academy of Art,18,0,"Ashlynn Dolcini,  Ryan Yasuda,  David Arden"
30067,3290,11/8/2022,Alfred,19,0,Morrisville St.,18,0,"Paul C,  Mike S,  Mike L"
30069,4593,11/9/2022,Franciscan,22,1,Wooster,21,0,"M Akers,  J. Wilkinson,  K Tortorice"
442,19465,11/11/2022,Montclair St.,14,0,Ithaca,16,0,"Morgan  Taylor,  David Claudio,  Tracey Stamper"
30085,7225,11/12/2022,Cairn,14,0,Lancaster Bible,12,0,"Daniel Stefankiewicz,  Phil Benson,  Stephen Dunn Jr."
30088,4577,11/11/2022,South Dakota Mines,25,0,Tex. Permian Basin,22,0,"Katelynn Hall,  Karli Jelden,  Dillon Fuller"
30088,4576,11/12/2022,Colorado Mesa,17,0,Tex. Permian Basin,18,0,"Landon Arnold,  Rory Robinson,  Jacob Finn"
30092,11751,11/13/2022,UVA Wise,11,0,Flagler,15,0,"Kim Crabtree,  Tony Sherrill and Jerry Lawson."
30092,11752,11/12/2022,Anderson (SC),17,0,Flagler,23,0,"Kevin Cui, Scott Neiderer, AJ Sibcy"
30095,10015,11/10/2022,Utah Tech,20,0,Benedictine Mesa,16,0,"Michal Ann Watts,  Esther Hsu,  In'fini  Robinson"
30095,10014,11/7/2022,Washington,16,0,Utah Tech,14,0,"Alecia Murray,  Teresa Turner,  Benny Luna"
30105,4250,11/12/2022,Westminster (UT),17,0,Ark.-Fort Smith,16,0,"Kayla Barker,  Dan Hooten,  Jessica Omer"
30105,4249,11/11/2022,Westminster (UT),11,0,Ark.-Fort Smith,21,0,"Jessica Omer,  Rick Thorne,  Steph Stassen"
30123,6410,11/12/2022,San Fran. St.,18,0,Academy of Art,10,0,"Mark Harman,  Jerry Ousley,  Tiffany Fong"
30123,6409,11/11/2022,Cal St. Monterey Bay,21,0,Academy of Art,18,0,"Ashlynn Dolcini,  Ryan Yasuda,  David Arden"
